{
  "$schema": "http://json-schema.org/draft-07/schema#",
  "type": "object",
  "required": [
    "proposal_id",
    "memory_type",
    "operation",
    "proposed_content",
    "reason",
    "created_at"
  ],
  "properties": {
    "proposal_id": { "type": "string" },
    "memory_type": { "type": "string" },
    "operation": {
      "type": "string",
      "enum": ["create", "update", "supersede", "invalidate"]
    },
    "target_memory_id": { "type": ["string", "null"] },
    "proposed_content": { "type": "string" },
    "reason": { "type": "string" },
    "source_refs": {
      "type": "array",
      "items": { "type": "string" }
    },
    "confidence": { "type": "number", "minimum": 0, "maximum": 1 },
    "risk_level": {
      "type": "string",
      "enum": ["low", "medium", "high"]
    },
    "approval_required": { "type": "boolean" },
    "proposer": { "type": "string" },
    "conflict_candidates": {
      "type": "array",
      "items": { "type": "string" }
    },
    "created_at": { "type": "string", "format": "date-time" }
  }
}
