{
  "proposal_id": "prop_001",
  "memory_type": "policy",
  "operation": "create",
  "target_memory_id": null,
  "proposed_content": "すべてのAPIレスポンスにリクエストIDを含める（X-Request-IDヘッダー）。この方針で統一する。",
  "reason": "ユーザーが明示的に「この方針で統一」と指示したため（evt_001）",
  "source_refs": ["sess_001:evt_001"],
  "confidence": 0.92,
  "risk_level": "low",
  "approval_required": true,
  "proposer": "extractor_v0",
  "conflict_candidates": [],
  "created_at": "2026-04-01T10:35:00Z"
}
